{
  "$schema": "https://json-schema.org/draft/2020-12/schema",
  "$id": "https://adc.local/contracts/components/inherited-interface.schema.json",
  "type": "object",
  "additionalProperties": false,
  "required": ["schemaVersion", "id", "source", "evidence", "props", "unresolved"],
  "properties": {
    "schemaVersion": { "const": 1 },
    "id": { "type": "string" },
    "source": { "$ref": "#/$defs/source" },
    "evidence": { "type": "object", "additionalProperties": { "$ref": "#/$defs/evidence" } },
    "props": { "type": "array", "items": { "$ref": "#/$defs/prop" } },
    "events": { "type": "array", "items": { "$ref": "#/$defs/event" } },
    "conditionalApi": { "type": "array", "items": { "$ref": "#/$defs/conditional" } },
    "unresolved": { "type": "array", "items": { "$ref": "#/$defs/unresolved" } }
  },
  "$defs": {
    "evidence": { "type": "object", "additionalProperties": false, "required": ["kind", "source"], "properties": { "kind": { "enum": ["canonical-source", "inherited-interface", "runtime-test", "token-contract"] }, "source": { "type": "string" } } },
    "refs": { "type": "array", "minItems": 1, "items": { "type": "string" } },
    "structured": { "oneOf": [
      { "type": "object", "additionalProperties": false, "required": ["kind"], "properties": { "kind": { "enum": ["boolean", "string", "number"] } } },
      { "type": "object", "additionalProperties": false, "required": ["kind", "values"], "properties": { "kind": { "const": "enum" }, "values": { "type": "array", "items": { "type": "string" } } } },
      { "type": "object", "additionalProperties": false, "required": ["kind", "value"], "properties": { "kind": { "const": "literal" }, "value": { "anyOf": [{ "type": "string" }, { "type": "number" }, { "type": "boolean" }] } } },
      { "type": "object", "additionalProperties": false, "required": ["kind", "item"], "properties": { "kind": { "const": "array" }, "item": { "$ref": "#/$defs/structured" } } },
      { "type": "object", "additionalProperties": false, "required": ["kind", "members"], "properties": { "kind": { "const": "union" }, "members": { "type": "array", "minItems": 2, "items": { "$ref": "#/$defs/structured" } } } },
      { "type": "object", "additionalProperties": false, "required": ["kind", "typeText"], "properties": { "kind": { "const": "typescript" }, "typeText": { "type": "string" } } }
    ] },
    "source": { "type": "object", "additionalProperties": false, "required": ["kind", "package", "version", "declarationPath", "declarationSha256", "symbol"], "properties": { "kind": { "enum": ["react-intrinsic", "package-declaration"] }, "package": { "type": "string" }, "version": { "type": "string" }, "declarationPath": { "type": "string" }, "declarationSha256": { "type": "string", "pattern": "^[0-9a-f]{64}$" }, "symbol": { "type": "string" } } },
    "prop": { "type": "object", "additionalProperties": false, "required": ["name", "required", "type", "typeText", "evidenceRefs"], "properties": { "name": { "type": "string" }, "required": { "type": "boolean" }, "type": { "$ref": "#/$defs/structured" }, "typeText": { "type": "string" }, "evidenceRefs": { "$ref": "#/$defs/refs" } } },
    "event": { "type": "object", "additionalProperties": false, "required": ["propName", "required", "payload", "payloadTypeText", "evidenceRefs"], "properties": { "propName": { "type": "string" }, "required": { "type": "boolean" }, "payload": { "$ref": "#/$defs/structured" }, "payloadTypeText": { "type": "string" }, "evidenceRefs": { "$ref": "#/$defs/refs" } } },
    "condition": { "type": "object", "additionalProperties": false, "required": ["propName", "equals"], "properties": { "propName": { "type": "string" }, "equals": { "anyOf": [{ "type": "string" }, { "type": "number" }, { "type": "boolean" }] } } },
    "propRefinement": { "oneOf": [
      { "type": "object", "additionalProperties": false, "required": ["propName", "availability", "required", "type", "evidenceRefs"], "properties": { "propName": { "type": "string" }, "availability": { "const": "available" }, "required": { "type": "boolean" }, "type": { "$ref": "#/$defs/structured" }, "evidenceRefs": { "$ref": "#/$defs/refs" } } },
      { "type": "object", "additionalProperties": false, "required": ["propName", "availability", "evidenceRefs"], "properties": { "propName": { "type": "string" }, "availability": { "const": "unavailable" }, "evidenceRefs": { "$ref": "#/$defs/refs" } } }
    ] },
    "eventRefinement": { "type": "object", "additionalProperties": false, "required": ["eventPropName", "payload", "evidenceRefs"], "properties": { "eventPropName": { "type": "string" }, "payload": { "$ref": "#/$defs/structured" }, "evidenceRefs": { "$ref": "#/$defs/refs" } } },
    "state": { "type": "object", "additionalProperties": false, "required": ["name", "evidenceRefs"], "anyOf": [{ "required": ["controlledProp"], "properties": { "controlledProp": { "type": "string" } } }, { "required": ["defaultProp"], "properties": { "defaultProp": { "type": "string" } } }, { "required": ["changeEventProp"], "properties": { "changeEventProp": { "type": "string" } } }], "properties": { "name": { "type": "string" }, "controlledProp": { "type": "string" }, "defaultProp": { "type": "string" }, "changeEventProp": { "type": "string" }, "evidenceRefs": { "$ref": "#/$defs/refs" } } },
    "conditional": { "type": "object", "additionalProperties": false, "required": ["when", "propRefinements", "eventRefinements", "stateChannels", "evidenceRefs"], "properties": { "when": { "$ref": "#/$defs/condition" }, "propRefinements": { "type": "array", "items": { "$ref": "#/$defs/propRefinement" } }, "eventRefinements": { "type": "array", "items": { "$ref": "#/$defs/eventRefinement" } }, "stateChannels": { "type": "array", "items": { "$ref": "#/$defs/state" } }, "evidenceRefs": { "$ref": "#/$defs/refs" } } },
    "unresolved": { "type": "object", "additionalProperties": false, "required": ["topic", "scope", "reason", "evidenceAttempted", "evidenceRefs"], "properties": { "topic": { "type": "string" }, "scope": { "type": "string" }, "reason": { "type": "string" }, "source": { "type": "object", "additionalProperties": false, "required": ["sourcePath", "start", "end", "expressionKind", "sourceText"], "properties": { "sourcePath": { "type": "string" }, "start": { "type": "integer", "minimum": 0 }, "end": { "type": "integer", "minimum": 0 }, "expressionKind": { "type": "string" }, "sourceText": { "type": "string" } } }, "evidenceAttempted": { "type": "array", "items": { "type": "string" } }, "evidenceRefs": { "$ref": "#/$defs/refs" } } }
  }
}
