{
  "schemaVersion": 1,
  "id": "html.ol",
  "source": {
    "kind": "react-intrinsic",
    "package": "@types/react",
    "version": "18.3.3",
    "declarationPath": "node_modules/@types/react/index.d.ts",
    "declarationSha256": "8ca4709dbd22a34bcc1ebf93e1877645bdb02ebd3f3d9a211a299a8db2ee4ba1",
    "symbol": "React.JSX.IntrinsicElements[\"ol\"]"
  },
  "evidence": {
    "declaration": {
      "kind": "inherited-interface",
      "source": "node_modules/@types/react/index.d.ts@8ca4709dbd22a34bcc1ebf93e1877645bdb02ebd3f3d9a211a299a8db2ee4ba1"
    }
  },
  "props": [
    {
      "name": "aria-label",
      "required": false,
      "type": {
        "kind": "string"
      },
      "typeText": "string",
      "evidenceRefs": [
        "declaration"
      ]
    },
    {
      "name": "aria-labelledby",
      "required": false,
      "type": {
        "kind": "string"
      },
      "typeText": "string",
      "evidenceRefs": [
        "declaration"
      ]
    },
    {
      "name": "children",
      "required": false,
      "type": {
        "kind": "typescript",
        "typeText": "ReactNode"
      },
      "typeText": "ReactNode",
      "evidenceRefs": [
        "declaration"
      ]
    },
    {
      "name": "className",
      "required": false,
      "type": {
        "kind": "string"
      },
      "typeText": "string",
      "evidenceRefs": [
        "declaration"
      ]
    },
    {
      "name": "id",
      "required": false,
      "type": {
        "kind": "string"
      },
      "typeText": "string",
      "evidenceRefs": [
        "declaration"
      ]
    },
    {
      "name": "reversed",
      "required": false,
      "type": {
        "kind": "boolean"
      },
      "typeText": "boolean",
      "evidenceRefs": [
        "declaration"
      ]
    },
    {
      "name": "role",
      "required": false,
      "type": {
        "kind": "typescript",
        "typeText": "AriaRole"
      },
      "typeText": "AriaRole",
      "evidenceRefs": [
        "declaration"
      ]
    },
    {
      "name": "start",
      "required": false,
      "type": {
        "kind": "number"
      },
      "typeText": "number",
      "evidenceRefs": [
        "declaration"
      ]
    },
    {
      "name": "type",
      "required": false,
      "type": {
        "kind": "typescript",
        "typeText": "\"1\" | \"a\" | \"A\" | \"i\" | \"I\""
      },
      "typeText": "\"1\" | \"a\" | \"A\" | \"i\" | \"I\"",
      "evidenceRefs": [
        "declaration"
      ]
    }
  ],
  "unresolved": [
    {
      "topic": "full intrinsic prop surface",
      "scope": "release.5 candidate inherited interface",
      "reason": "This candidate records Breadcrumb-relevant React intrinsic props only. The full @types/react 18.3.3 interface must be generated by the canonical TypeScript analyzer before release.5 manifest cutover.",
      "evidenceAttempted": [
        "pinned @types/react 18.3.3 declaration",
        "existing canonical intrinsic-interface analyzer"
      ],
      "evidenceRefs": [
        "declaration"
      ]
    }
  ]
}
