{
  "schemaVersion": 1,
  "id": "radix.dropdown-menu.root",
  "source": {
    "kind": "package-declaration",
    "package": "@radix-ui/react-dropdown-menu",
    "version": "2.1.24",
    "declarationPath": "node_modules/@radix-ui/react-dropdown-menu/dist/index.d.ts",
    "declarationSha256": "26e6c521a290630ea31f0205a46a87cab35faac96e2b30606f37bae7bcda4f9d",
    "symbol": "Root"
  },
  "evidence": {
    "declaration": {
      "kind": "inherited-interface",
      "source": "node_modules/@radix-ui/react-dropdown-menu/dist/index.d.ts@26e6c521a290630ea31f0205a46a87cab35faac96e2b30606f37bae7bcda4f9d"
    }
  },
  "props": [
    {
      "name": "open",
      "required": false,
      "type": {
        "kind": "boolean"
      },
      "typeText": "boolean",
      "evidenceRefs": [
        "declaration"
      ]
    },
    {
      "name": "defaultOpen",
      "required": false,
      "type": {
        "kind": "boolean"
      },
      "typeText": "boolean",
      "evidenceRefs": [
        "declaration"
      ]
    },
    {
      "name": "modal",
      "required": false,
      "type": {
        "kind": "boolean"
      },
      "typeText": "boolean",
      "evidenceRefs": [
        "declaration"
      ]
    }
  ],
  "events": [
    {
      "propName": "onOpenChange",
      "required": false,
      "payload": {
        "kind": "boolean"
      },
      "payloadTypeText": "boolean",
      "evidenceRefs": [
        "declaration"
      ]
    }
  ],
  "conditionalApi": [],
  "unresolved": []
}
