{"schemaVersion":1,"id":"radix.tooltip.provider","source":{"kind":"package-declaration","package":"@radix-ui/react-tooltip","version":"1.2.16","declarationPath":"node_modules/@radix-ui/react-tooltip/dist/index.d.ts","declarationSha256":"233267a4a036c64aee95f66a0d31e3e0ef048cccc57dd66f9cf87582b38691e4","symbol":"Provider"},"evidence":{"declaration":{"kind":"inherited-interface","source":"node_modules/@radix-ui/react-tooltip/dist/index.d.ts@233267a4a036c64aee95f66a0d31e3e0ef048cccc57dd66f9cf87582b38691e4"}},"props":[{"name":"children","required":true,"type":{"kind":"union","members":[{"kind":"string"},{"kind":"number"},{"kind":"typescript","typeText":"bigint"},{"kind":"literal","value":false},{"kind":"literal","value":true},{"kind":"typescript","typeText":"React.ReactElement<unknown, string | React.JSXElementConstructor<any>>"},{"kind":"typescript","typeText":"Iterable<React.ReactNode>"},{"kind":"typescript","typeText":"React.ReactPortal"},{"kind":"typescript","typeText":"Promise<string | number | bigint | boolean | React.ReactPortal | React.ReactElement<unknown, string | React.JSXElementConstructor<any>> | Iterable<React.ReactNode>>"}]},"typeText":"React.ReactNode","evidenceRefs":["declaration"]},{"name":"delayDuration","required":false,"type":{"kind":"number"},"typeText":"number","evidenceRefs":["declaration"]},{"name":"skipDelayDuration","required":false,"type":{"kind":"number"},"typeText":"number","evidenceRefs":["declaration"]},{"name":"disableHoverableContent","required":false,"type":{"kind":"boolean"},"typeText":"boolean","evidenceRefs":["declaration"]}],"events":[],"conditionalApi":[],"unresolved":[]}
