{"schemaVersion":1,"id":"radix.tooltip.root","source":{"kind":"package-declaration","package":"@radix-ui/react-tooltip","version":"1.2.16","declarationPath":"node_modules/@radix-ui/react-tooltip/dist/index.d.ts","declarationSha256":"233267a4a036c64aee95f66a0d31e3e0ef048cccc57dd66f9cf87582b38691e4","symbol":"Root"},"evidence":{"declaration":{"kind":"inherited-interface","source":"node_modules/@radix-ui/react-tooltip/dist/index.d.ts@233267a4a036c64aee95f66a0d31e3e0ef048cccc57dd66f9cf87582b38691e4"}},"props":[{"name":"children","required":false,"type":{"kind":"union","members":[{"kind":"string"},{"kind":"number"},{"kind":"literal","value":false},{"kind":"literal","value":true},{"kind":"typescript","typeText":"React.ReactElement<any, string | React.JSXElementConstructor<any>>"},{"kind":"typescript","typeText":"Iterable<React.ReactNode>"},{"kind":"typescript","typeText":"React.ReactPortal"}]},"typeText":"React.ReactNode","evidenceRefs":["declaration"]},{"name":"open","required":false,"type":{"kind":"boolean"},"typeText":"boolean","evidenceRefs":["declaration"]},{"name":"defaultOpen","required":false,"type":{"kind":"boolean"},"typeText":"boolean","evidenceRefs":["declaration"]},{"name":"delayDuration","required":false,"type":{"kind":"number"},"typeText":"number","evidenceRefs":["declaration"]},{"name":"disableHoverableContent","required":false,"type":{"kind":"boolean"},"typeText":"boolean","evidenceRefs":["declaration"]}],"events":[{"propName":"onOpenChange","required":false,"payload":{"kind":"boolean"},"payloadTypeText":"boolean","evidenceRefs":["declaration"]}],"conditionalApi":[],"unresolved":[]}
