{"schemaVersion":1,"id":"radix.scroll-area.thumb","source":{"kind":"package-declaration","package":"@radix-ui/react-scroll-area","version":"1.2.18","declarationPath":"node_modules/@radix-ui/react-scroll-area/dist/index.d.ts","declarationSha256":"99d1a601593495371e798da1850b52877bf63d0678f15722d5f048e404f002e4","symbol":"ScrollAreaThumb"},"evidence":{"declaration":{"kind":"inherited-interface","source":"node_modules/@radix-ui/react-scroll-area/dist/index.d.ts@99d1a601593495371e798da1850b52877bf63d0678f15722d5f048e404f002e4"}},"props":[{"name":"forceMount","required":false,"type":{"kind":"literal","value":true},"typeText":"true","evidenceRefs":["declaration"]}],"events":[],"conditionalApi":[],"unresolved":[]}
