{"schemaVersion":1,"id":"radix.dialog.trigger","source":{"kind":"package-declaration","package":"@radix-ui/react-dialog","version":"1.1.23","declarationPath":"node_modules/@radix-ui/react-dialog/dist/index.d.ts","declarationSha256":"2059b04988eece7f6e992a5c218e9c5361b8fed24cb04caddb7e1cb4339e236b","symbol":"Trigger"},"evidence":{"declaration":{"kind":"inherited-interface","source":"node_modules/@radix-ui/react-dialog/dist/index.d.ts@2059b04988eece7f6e992a5c218e9c5361b8fed24cb04caddb7e1cb4339e236b"}},"props":[{"name":"asChild","required":false,"type":{"kind":"boolean"},"typeText":"boolean","evidenceRefs":["declaration"]}],"events":[],"conditionalApi":[],"unresolved":[]}
