{"schemaVersion":1,"id":"radix.select.content","source":{"kind":"package-declaration","package":"@radix-ui/react-select","version":"2.3.7","declarationPath":"node_modules/@radix-ui/react-select/dist/index.d.ts","declarationSha256":"a0fa43b27364a340ea7639ff5fdffbcd375ecf49e6ed5df3eec73b3d74a84d58","symbol":"Content"},"evidence":{"declaration":{"kind":"inherited-interface","source":"node_modules/@radix-ui/react-select/dist/index.d.ts@a0fa43b27364a340ea7639ff5fdffbcd375ecf49e6ed5df3eec73b3d74a84d58"}},"props":[{"name":"position","required":false,"type":{"kind":"enum","values":["item-aligned","popper"]},"typeText":"\"item-aligned\" | \"popper\"","evidenceRefs":["declaration"]},{"name":"forceMount","required":false,"type":{"kind":"literal","value":true},"typeText":"true","evidenceRefs":["declaration"]},{"name":"asChild","required":false,"type":{"kind":"boolean"},"typeText":"boolean","evidenceRefs":["declaration"]}],"events":[],"conditionalApi":[],"unresolved":[]}
