{"schemaVersion":1,"id":"radix.accordion.content","source":{"kind":"package-declaration","package":"@radix-ui/react-accordion","version":"1.2.20","declarationPath":"node_modules/@radix-ui/react-accordion/dist/index.d.ts","declarationSha256":"f60d8ad8a1015f2f813f665d3a6164d4af8f4ebdd896d067506a21b1c0f57c66","symbol":"Content"},"evidence":{"declaration":{"kind":"inherited-interface","source":"node_modules/@radix-ui/react-accordion/dist/index.d.ts@f60d8ad8a1015f2f813f665d3a6164d4af8f4ebdd896d067506a21b1c0f57c66"}},"props":[],"events":[],"conditionalApi":[],"unresolved":[]}
