{"schemaVersion":1,"id":"radix.tooltip.portal","source":{"kind":"package-declaration","package":"@radix-ui/react-tooltip","version":"1.2.16","declarationPath":"node_modules/@radix-ui/react-tooltip/dist/index.d.ts","declarationSha256":"233267a4a036c64aee95f66a0d31e3e0ef048cccc57dd66f9cf87582b38691e4","symbol":"Portal"},"evidence":{"declaration":{"kind":"inherited-interface","source":"node_modules/@radix-ui/react-tooltip/dist/index.d.ts@233267a4a036c64aee95f66a0d31e3e0ef048cccc57dd66f9cf87582b38691e4"}},"props":[{"name":"container","required":false,"type":{"kind":"union","members":[{"kind":"typescript","typeText":"Element"},{"kind":"typescript","typeText":"DocumentFragment"}]},"typeText":"Element | DocumentFragment","evidenceRefs":["declaration"]},{"name":"forceMount","required":false,"type":{"kind":"literal","value":true},"typeText":"true","evidenceRefs":["declaration"]}],"events":[],"conditionalApi":[],"unresolved":[]}
