{"schemaVersion":1,"id":"radix.tooltip.trigger","source":{"kind":"package-declaration","package":"@radix-ui/react-tooltip","version":"1.2.16","declarationPath":"node_modules/@radix-ui/react-tooltip/dist/index.d.ts","declarationSha256":"233267a4a036c64aee95f66a0d31e3e0ef048cccc57dd66f9cf87582b38691e4","symbol":"Trigger"},"evidence":{},"props":[],"events":[],"conditionalApi":[],"unresolved":[]}
