{"schemaVersion":1,"id":"radix.dropdown-menu.radio-item","source":{"kind":"package-declaration","package":"@radix-ui/react-dropdown-menu","version":"2.1.24","declarationPath":"node_modules/@radix-ui/react-dropdown-menu/dist/index.d.ts","declarationSha256":"26e6c521a290630ea31f0205a46a87cab35faac96e2b30606f37bae7bcda4f9d","symbol":"RadioItem"},"evidence":{"declaration":{"kind":"inherited-interface","source":"node_modules/@radix-ui/react-dropdown-menu/dist/index.d.ts@26e6c521a290630ea31f0205a46a87cab35faac96e2b30606f37bae7bcda4f9d"}},"props":[{"name":"value","required":true,"type":{"kind":"string"},"typeText":"string","evidenceRefs":["declaration"]},{"name":"asChild","required":false,"type":{"kind":"boolean"},"typeText":"boolean","evidenceRefs":["declaration"]}],"events":[],"conditionalApi":[],"unresolved":[]}
